applicationid,fname,lname,address,compositevector,countryofbirth,emailaddress,gender
1,Sandeep,Kumar,Great Russell St London WC1B 3DG,Sandeep Kumar Great Russell St London WC1B 3DG,United Kingdom,test1@gmail.com,Male
2,Durga,Pentaboyina,10 Downing Street London SW1A 2AA, Durga Pentaboyina 10 Downing Street London SW1A 2AA,United Kingdom,test2@gmail.com,Male
3,Hemant,Durai,Sir Matt Busby Way Old Trafford Mancester M16 0RA,Hemant Durai Sir Matt Busby Way Old Trafford Mancester M16 0RA,United Kingdom,test3@gmail.com,Male
4,Tejeswar,Ivaturi,Windsor Berkshire SL4 1NJ,Tejeswar Ivaturi Windsor Berkshire SL4 1NJ,United Kingdom,test4@gmail.com,Male
5,Pooja,Reddy,The Old Schools Trnity Lane Cambridge CB2 1TN, Pooja Reddy The Old Schools Trnity Lane Cambridge CB2 1TN,United Kingdom,test5@gmail.com,Female